{
    "description": {
        "author": "Salesforce",
        "text": [
            "Selector: gen_ai_agentbuilder-add-new-item",
            "Button for creating a new agent"
        ]
    },
    "root": true,
    "selector": {
        "css": "gen_ai_agentbuilder-add-new-item"
    },
    "shadow": {
        "elements": [
            {
                "public": true,
                "name": "buttonStateful",
                "type": "utam-lightning/pageObjects/buttonStateful",
                "selector": {
                    "css": "lightning-button-stateful"
                }
            },
            {
                "public": true,
                "name": "button",
                "type": "utam-lightning/pageObjects/button",
                "selector": {
                    "css": "lightning-button"
                }
            },
            {
                "public": true,
                "name": "buttonIcon",
                "type": "utam-lightning/pageObjects/buttonIcon",
                "selector": {
                    "css": "lightning-button-icon"
                }
            }
        ]
    }
}