{
    "description": {
        "author": "Salesforce",
        "text": [
            "Selector: webruntimedesign-email-component-node",
            "Represents the canvas iframe content with shadow root navigation to actualNode elements."
        ]
    },
    "root": true,
    "selector": {
        "css": "webruntimedesign-email-component-node"
    },
    "beforeLoad": [
        {
            "apply": "waitFor",
            "args": [
                {
                    "type": "function",
                    "name": "unused",
                    "predicate": [
                        {
                            "element": "root",
                            "apply": "containsElement",
                            "args": [
                                {
                                    "type": "locator",
                                    "value": {
                                        "css": "div.interactions-component.interactions-element"
                                    }
                                },
                                {
                                    "value": true
                                }
                            ]
                        }
                    ]
                }
            ]
        }
    ],
    "shadow": {
        "elements": [
            {
                "name": "proxySelectToolbox",
                "public": true,
                "nullable": true,
                "selector": {
                    "css": "section.proxy-select-toolbox"
                },
                "elements": [
                    {
                        "name": "toolbarGroups",
                        "public": true,
                        "selector": {
                            "css": "es_design-toolbar > es_design-toolbar-group",
                            "returnAll": true
                        },
                        "elements": [
                            {
                                "name": "toolbarButtons",
                                "public": true,
                                "nullable": true,
                                "selector": {
                                    "css": "es_design-toolbar-button",
                                    "returnAll": true
                                }
                            },
                            {
                                "name": "toolbarButtonByDataId",
                                "public": true,
                                "nullable": true,
                                "selector": {
                                    "css": "es_design-toolbar-button[data-id='%s']",
                                    "args": [
                                        {
                                            "name": "dataId",
                                            "type": "string"
                                        }
                                    ]
                                }
                            }
                        ]
                    }
                ]
            },
            {
                "name": "interactionsElements",
                "public": true,
                "selector": {
                    "css": "div.interactions-component.interactions-element",
                    "returnAll": true
                }
            },
            {
                "name": "interactionsElementByDataComponentLabel",
                "public": true,
                "nullable": true,
                "selector": {
                    "css": "div.interactions-component.interactions-element[data-component-label='%s']",
                    "args": [
                        {
                            "name": "label",
                            "type": "string"
                        }
                    ]
                }
            }
        ]
    },
    "methods": [
        {
            "name": "waitForProxySelectToolboxVisible",
            "description": {
                "text": [
                    "Waits for the toolbar to be visible"
                ]
            },
            "compose": [
                {
                    "apply": "waitFor",
                    "args": [
                        {
                            "type": "function",
                            "predicate": [
                                {
                                    "element": "root",
                                    "apply": "containsElement",
                                    "args": [
                                        {
                                            "type": "locator",
                                            "value": {
                                                "css": "section.proxy-select-toolbox"
                                            }
                                        },
                                        {
                                            "value": true
                                        }
                                    ]
                                }
                            ]
                        }
                    ]
                }
            ]
        },
        {
            "name": "waitForToolbarGroupsSizeOverThree",
            "description": "Waits for the size of toolbar groups to be over 3",
            "compose": [
                {
                    "apply": "waitFor",
                    "args": [
                        {
                            "type": "function",
                            "predicate": [
                                {
                                    "element": "root",
                                    "apply": "containsElement",
                                    "args": [
                                        {
                                            "type": "locator",
                                            "value": {
                                                "css": "es_design-toolbar > es_design-toolbar-group:nth-child(n+4)"
                                            }
                                        },
                                        {
                                            "value": true
                                        }
                                    ]
                                }
                            ]
                        }
                    ]
                }
            ]
        }
    ]
}