{
    "description": {
        "author": "Salesforce",
        "text": [
            "Selector: runtime_sales_pathassistant-path-track-scroller",
            "Represents the runtime_sales_pathassistant-path-track-scroller component."
        ]
    },
    "root": true,
    "selector": {
        "css": "runtime_sales_pathassistant-path-track-scroller"
    },
    "exposeRootElement": true,
    "type": [
        "actionable",
        "clickable"
    ]
}